{
  "eventId": "f1f2f3f4-0002-4ccc-8ddd-eeeeeeeeeeee",
  "eventType": "factory.model-authorization",
  "schemaVersion": 1,
  "recordType": "AUTHORIZATION",
  "modelName": "bearing-health",
  "modelVersion": "1.5.0",
  "modelRunId": "mlflow-run-9f8e7d6c",
  "deploymentStage": "CANARY",
  "quarantined": true,
  "oodThreshold": 0.35,
  "confidenceThreshold": 0.7,
  "featureSchemaVersion": 3,
  "authorizedEquipmentCohort": [
    "eq-001",
    "eq-002"
  ],
  "authorizationSequence": 17,
  "issuedAtUtc": "2026-09-15T04:10:00.000Z",
  "validUntilUtc": "2026-09-16T04:10:00.000Z",
  "occurredAtUtc": "2026-09-15T04:10:00.000Z",
  "ingestTimeUtc": "2026-09-15T04:10:00.041Z",
  "producer": "mlops-publisher@mlops-1",
  "correlationId": "2b3c4d5e-6f70-4812-9a3b-4c5d6e7f8091",
  "causationId": null,
  "partitionKey": "bearing-health"
}
